Date,Open,High,Low,Close,Adj Close,Volume,News
2007-01-05,12.252857,12.314285,12.057143,85.049995,12.15,208685400,"Rodeo in the Big Apple  : Cowboys from around the world gathered at Madison Square Garden for the Professional Bull Riders Versus Invitational.Who Is Best at R&D? : Apple, Caterpillar, Google, Kellogg and Toyota are among the smartest companies when it comes to what they reap for their research and development dollars.Macworld Bingo : In Macworld Bingo, watch a speech by Apple’s chief, Steve Jobs, and check off the typical Apple presentation elements as they occur.Verizon to Announce Plan for TV Shows on Cellphones : Verizon is expected to announce full-length programming to its cellular subscribers from several major television networks.Copyrights and Congress : Advocates for looser copyright restrictions had their hopes dashed when Representative Howard L. Berman was named chairman of the subcommittee for Internet and intellectual property.No Place for a Zamboni: A Hockey Rink Where Players Sink : Underwater hockey — a sport incorporating lead pucks, stout wooden sticks, rubberized gloves, snorkels, face masks and bulbous ear guards — is in a realm of its own.What's on Monday Night : 8 P.M. (Bravo) INSIDE THE ACTORS STUDIO His first film role was a one-liner in “Mystic Pizza.” And that was about it, career-wise, for the next few years. But then he and his childhood friend Ben Affleck came up with a project called “Good Will Hu...What's on Monday Night : 8 P.M. (Bravo) INSIDE THE ACTORS STUDIO -- His first film role was a one-liner in ''Mystic Pizza.'' And that was about it, career-wise, for the next few years. But then he and his childhood friend Ben Affleck came up with a project called ''Good W...Arts, Briefly : Private eye Anthony Pellicano turns lawyer, downloads on the British pop charts, O. J. Simpson advance frozen and more culture news.Theater Listings : THEATER."
2007-01-08,12.28,12.361428,12.182858,85.470001,12.21,199276700,"Praise for Apple : John Sculley, the former C.E.O. of Apple Computer, may have gotten the boot from Steve Jobs, but hey, no hard feelings.New Mobile Phone Signals Apple’s Ambition : Steven P. Jobs said the phone would lead to a synthesis of communications, video, music and computing.Taiwan Firm Sues Apple in Shuffle Skirmish : Luxpro, fresh from a legal victory against Apple Computer over whether its portable music players are ripoffs of Apple's iPod Shuffle, is seeking $100 million in damages in the case. Luxpro of Taiwan was previously sued by Apple, which claimed Lux...For Parents, New Ways to Control the Action : It is not overreaching to say that if you have young children who play computer games or use the Internet you are basically remiss if you do not upgrade to Vista as soon as possible.A Personal Computer to Carry in a Pocket : The newest cellphone screens are evolving to adopt more and more characteristics of a personal computer.Dear Diary : “Whoever is stealing my Wall Street Journal, would you please stop? If you can’t afford the 75 cents, maybe it’s not working out for you anyway.”Looking Ahead : CONFERENCE SEASON Three major consumer-oriented business conferences will be vying for headlines this week, with new product announcements from participating companies expected to be flying thick and fast. New cars, computers, televisions, electro...Mr. Schwarzenegger&#8217;s Modest Idea : Special recognition is due California’s governor, Arnold Schwarzenegger, who is reportedly ready to begin his new term with an actual proposal that his state insure all children.WHAT'S ON TONIGHT : 8 P.M. (Bravo) INSIDE THE ACTORS STUDIO -- His first film role was a one-liner in ''Mystic Pizza.'' And that was about it, career-wise, for the next few years. But then he and his childhood friend Ben Affleck came up with a project called ''Good W...I’ll Have Fries and a Glass of Your Best Champagne : Matching food with wine is an art. And while not everyone can agree on good art, everyone can agree on what is bad art."
2007-01-09,12.35,13.282857,12.164286,92.57,13.224286,837324600,"Apple Introduces Innovative Cellphone : Apple chose the name iPhone even though Cisco Systems had recently introduced a Wi-Fi-based phone with the same name.Samsung vs. Apple : Samsung thinks it can crack Apple’s hold on the music player market.In Cingular-Apple Deal, Only Phone Was Missing : With no prototype, the Cingular board’s approval of the partnership was an act of blind trust.New Mobile Phone Signals Apple’s Ambition : Steven P. Jobs said the phone would lead to a synthesis of communications, video, music and computing.For Apple Chief, Gadgets' Glitter Outshines Scandal : As Steve Jobs was preparing to take the stage at the MacWorld trade show to make his buzz-drenched annual keynote address, pundits were piling on to excoriate him for Apple's options-backdating scandal. True to form, Mr. Jobs riveted the audience ...Corrections : Because of an editing error, an article in Business Day on Jan. 1 about plans by the Walt Disney Company to introduce a revamped Web site at the Consumer Electronics Show referred incorrectly to the business relationship between Apple and Pixar An...Correction: For the Record : Because of an editing error, an article in Business Day on Jan. 1 about plans by the Walt Disney Company to introduce a revamped Web site at the Consumer Electronics Show referred incorrectly to the business relationship between Apple and Pixar An...The iPhone Rumors Are Right&#8230;Finally : OK, so after three years of being wrong, the rumor sites were finally right. Now there IS an Apple cellphone. Or, rather, will be one in June.Pricing the iPhone : Rob Glaser, chief executive of Real Networks, on Apple’s new iPhone.Today in Business : CH&#225;VEZ PLAN DRAWS ALARM Investors reacted with alarm in the United States and throughout Latin America as they measured the impact of a plan by Venezuela&#8217;s president, Hugo Ch&#225;vez, left, to nationalize critical areas of the economy...."
2007-01-10,13.535714000000002,13.971429,13.35,97.0,13.857142000000001,738220000,"Apple Waves Its Wand at the Phone : The new iPhone is so packed with possibilities that the cellphone may actually be the least interesting part.Apple Introduces Innovative Cellphone : Apple chose the name iPhone even though Cisco Systems had recently introduced a Wi-Fi-based phone with the same name.Cisco, Claiming Ownership of ‘iPhone,’ Sues Apple : Cisco Systems filed a trademark infringement lawsuit against Apple, claiming rights to the iPhone brand.Apple Waves Its Wand, Again : Steve Jobs has granted the wishes of Apple followers by turning the ordinary cellphone into the iPhone.In Cingular-Apple Deal, Only Phone Was Missing : With no prototype, the Cingular board’s approval of the partnership was an act of blind trust.Phone Shows Apple’s Impact on Consumer Products : Steve Jobs’s method is to refine existing technologies.Cisco Sues Apple Over Use of iPhone Name : Cisco has owned the trademark on the name ""iPhone"" since 2000, when it acquired InfoGear Technology Corp., which originally registered the name.Corrections : Because of an editing error, an article in Business Day on Jan. 1 about plans by the Walt Disney Company to introduce a revamped Web site at the Consumer Electronics Show referred incorrectly to the business relationship between Apple and Pixar An...Correction: For the Record : Because of an editing error, an article in Business Day on Jan. 1 about plans by the Walt Disney Company to introduce a revamped Web site at the Consumer Electronics Show referred incorrectly to the business relationship between Apple and Pixar An...Getting Graphic With Vista  : When shopping for a new computer, what kind of graphics card will be necessary to run Microsoft’s Windows Vista?"
2007-01-11,13.705714000000002,13.825714000000001,13.585714000000001,95.800003,13.685715,360063200,"Apple Waves Its Wand at the Phone : The new iPhone is so packed with possibilities that the cellphone may actually be the least interesting part.The Apple of Their Eyes : Judging form the first bunch of comments we got about the iPhone, Mr. Jobs has another hit on his hands.Cisco, Claiming Ownership of ‘iPhone,’ Sues Apple : Cisco Systems filed a trademark infringement lawsuit against Apple, claiming rights to the iPhone brand.Phone Shows Apple’s Impact on Consumer Products : Steve Jobs’s method is to refine existing technologies.Steve Jobs Walks the Tightrope Again : If the iPhone succeeds commercially, it will be proof of Steven P. Jobs’s power and influence over the world’s consumer marketplace.Getting Graphic With Vista  : When shopping for a new computer, what kind of graphics card will be necessary to run Microsoft’s Windows Vista?The Ultimate iPhone Frequently Asked Questions : Apple's new device has prompted both negative and positive reactions from readers, along with a torrent of questions.The Ultimate iPhone Frequently Asked Questions : Apple's new device has prompted both negative and positive reactions from readers, along with a torrent of questions.The Ultimate iPhone Frequently Asked Questions : Apple’s new device has prompted both negative and positive reactions from readers, along with a torrent of questions.Shares Gain as Investors Shrug Off Declining Oil Prices : Investors fretted over falling oil prices, but Wall Street still managed a modest gain after upbeat news from Alcoa and Apple."
2007-01-12,13.512857,13.58,13.318570999999999,94.620003,13.517142999999999,328172600,"Nice Phone, Mr. Jobs, But ... : Steve Jobs may have a golden gut when it comes to cool tech products. But when it comes to dealing with regulators, it looks as if he and his company have a tin ear.Steve Jobs Walks the Tightrope Again : If the iPhone succeeds commercially, it will be proof of Steven P. Jobs’s power and influence over the world’s consumer marketplace.A Lot of Uncertainty, Except on Wall Street : Stocks rallied despite uncertainty, suggesting investor optimism, in part because of acceleration of the sustained fall in energy prices.AOL, Now Focused on Free, Sells Its Paid Music Service : After six years of trying to build an online music service, AOL agreed to sell its AOL Music Now to Napster for $15 million.Early Loss Overcome, Dow Sets a Record : The Dow had its second consecutive record close as investors embraced robust economic data and shrugged off several profit warnings.Arts, Briefly : Ballet at the Barricades       Simone Clarke, a principal dancer of the English National Ballet, was the object of a protest demonstration yesterday outside a London theater by a group called Unite Against Fascism, Reuters reported. The protest, a...Arts, Briefly : Ballet at the barricades, following her father’s path, an evening with an actor and more culture news.AT&T Prepares to ‘De-Brand’ the Cingular Wireless Name : AT&T, now the sole owner of Cingular Wireless, will begin changing all Cingular marketing to adopt the AT&T name.Robert Anton Wilson, 74, Who Wrote Mind-Twisting Novels, Dies : Robert Anton Wilson was an author of “The Illuminatus! Trilogy” — a mind-twisting science-fiction series about a secret global society that has been a cult classic for more than 30 years.The $250,000 Question : If you have a quarter of a million dollars to spend on a second home, what can you buy and where?"
2007-01-16,13.668571,13.892857999999999,13.635715,97.099998,13.871428,311019100,"Defending the Big Buyout : In a Q&A in The New York Times, William J. Holstein, editor in chief of Directorship magazine, discusses current trends in private equity buyouts with Justin B. Wender, president of Castle Harlan, a private equity firm in New York that specializes...New Warning on Earnings From Maker of BlackBerry : Research in Motion gave investors no better sense of the size of the earnings restatement the company will make after a review of its stock option grants to employees.Atop TV Sets, Basic Black Boxes Face Competition : As consumers stray, the traditional cable box is getting  a high-tech overhaul.Camper Is Rescued 5 Weeks After Disappearing : The camper, Carolyn Dorn of South Carolina, entered Gila National Forest alone on Dec. 6 for a two-week camping trip. Netflix to Deliver Movies to the PC : Netflix is introducing a service to deliver movies and television shows directly to PCs, not as downloads but as streaming video.The Shifting Business of Renting Movies, by the Disc or the Click : Wikipedia, the online encyclopedia, lists more than five dozen personalities whose obituaries were published prematurely. Someone may want to add Netflix to that list.      The impending death of the company, with its online system for renting DVD...The Food Pyramid Takes Its Show on the Road : The Agriculture Department has joined forces with food retailers and manufacturers to get more Americans to follow dietary guidelines.3 Lands of Orient Compete With French Holiday Favors : A porcelain works in a mountain village is threatened as manufacturers in Thailand, Vietnam and China flood the French market with the favors, which are baked into cakes.The Voices In My Head Say 'Buy It!' Why Argue? : Now that scientists have spotted the pain and pleasure centers in the brain, they've moved on to more expensive real estate: the brain's shopping center. They have been asking the big questions:     What is the difference between a tightwad's brai...The Voices in My Head Say ‘Buy It!’ Why Argue? : What is the difference between a tightwad’s brain and a spendthrift’s brain?"
2007-01-17,13.937142999999999,13.942857,13.545714000000002,94.949997,13.564285,411565000,"Apple Profit Rose 78% in Quarter : Apple delivered $1 billion in profit for its first quarter, based largely on the Christmas performance of its iPod music player business.How Gentlemen Disagree : A few weeks ago, I singled out an especially poorly written, hostile e-mail from a 15-year-old named Josh to support my theory that in the Internet age, civility is an endangered species. So it's only fair that I also show you this counterexample....Shares Dip on Worries Over Interest Rates : A Fed report deflated hopes for an interest rate cut that had already been diminished by a larger-than-expected rise in the Producer Price Index.The Netherlands: Chip Supplier Soars : ASML Holding, maker of the most expensive machines in chip fabrication, said fourth-quarter profit quadrupled on demand for semiconductors used in iPod music devices and mobile phones. Net income jumped to a record 205.5 million euros ($265.7 mill...Offline Options for Backup : What are the alternatives for backing up a computer’s data if you don’t want to use an online service?News Summary : INTERNATIONAL   A3-12    Iraqi Government Arrests Members of Sadr Militia  Iraqi officials said they had arrested several dozen senior members of the Mahdi Army, the powerful Shiite militia led by the cleric Moktada al-Sadr, marking the first time...TODAY IN BUSINESS : BUYOUT BATTLE FOR REIT -- A group of investors offered $38 billion for Equity Office Properties, the nation's largest office landlord, topping a $36 billion deal that Equity Office had reached with the Blackstone Group, and setting off the biggest...New Warning on Earnings From Maker of BlackBerry : Research in Motion gave investors no better sense of the size of the earnings restatement the company will make after a review of its stock option grants to employees.Atop TV Sets, Basic Black Boxes Face Competition : As consumers stray, the traditional cable box is getting  a high-tech overhaul.The Food Pyramid Takes Its Show on the Road : The Agriculture Department has joined forces with food retailers and manufacturers to get more Americans to follow dietary guidelines."
2007-01-18,13.157143,13.158570999999998,12.721428999999999,89.07,12.724286,591151400,"Apple Profit Rose 78% in Quarter : Apple delivered $1 billion in profit for its first quarter, based largely on the Christmas performance of its iPod music player business.Apple's Stellar Results Help Options Medicine Go Down : Apparently, nothing effaces the stigma of a scandal like a billion-dollar profit, as BusinessWeek, looking at Apple's recent sales figures, points out. Buoyed by record sales of 21 million of its signature iPod digital media players, Apple reaped ...Shares Fall on Technology Sales Forecasts : Declining oil prices sent energy shares down and sales forecasts from technology companies fell below analysts’ estimates.Shares Dip on Worries Over Interest Rates : A Fed report deflated hopes for an interest rate cut that had already been diminished by a larger-than-expected rise in the Producer Price Index.The Netherlands: Chip Supplier Soars : ASML Holding, maker of the most expensive machines in chip fabrication, said fourth-quarter profit quadrupled on demand for semiconductors used in iPod music devices and mobile phones. Net income jumped to a record 205.5 million euros ($265.7 mill...Offline Options for Backup : What are the alternatives for backing up a computer’s data if you don’t want to use an online service?News Summary : INTERNATIONAL   A3-12    Iraqi Government Arrests Members of Sadr Militia  Iraqi officials said they had arrested several dozen senior members of the Mahdi Army, the powerful Shiite militia led by the cleric Moktada al-Sadr, marking the first time...TODAY IN BUSINESS : BUYOUT BATTLE FOR REIT -- A group of investors offered $38 billion for Equity Office Properties, the nation's largest office landlord, topping a $36 billion deal that Equity Office had reached with the Blackstone Group, and setting off the biggest...What’s on Friday Night : 9 P.M. (Animal Planet) MS. ADVENTURE Rachel Reenstra will be the first to admit that she’s no expert when it comes to animal behavior, although she does have a master’s degree in spiritual psychology and some experience in the proverbial jungle. I...WHAT'S ON TONIGHT : 9 P.M. (Animal Planet) MS. ADVENTURE -- Rachel Reenstra will be the first to admit that she's no expert when it comes to animal behavior, although she does have a master's degree in spiritual psychology and some experience in the proverbial jungle..."
2007-01-19,12.661427999999999,12.807143,12.588572000000001,88.5,12.642858,341118400,"Figuring Out the P.E. Ratio of Steve Jobs : Steven P. Jobs has been on a spectacular winning streak this decade, and the company would not be the same without him.Shares Fall on Technology Sales Forecasts : Declining oil prices sent energy shares down and sales forecasts from technology companies fell below analysts’ estimates.What’s on Friday Night : 9 P.M. (Animal Planet) MS. ADVENTURE Rachel Reenstra will be the first to admit that she’s no expert when it comes to animal behavior, although she does have a master’s degree in spiritual psychology and some experience in the proverbial jungle. I...WHAT'S ON TONIGHT : 9 P.M. (Animal Planet) MS. ADVENTURE -- Rachel Reenstra will be the first to admit that she's no expert when it comes to animal behavior, although she does have a master's degree in spiritual psychology and some experience in the proverbial jungle...I.B.M. Sales Beat Forecasts on Software and Services : I.B.M.’s profit slightly surpassed estimates, lifted by strong software sales and a solid performance from its big services unit.St. Benedict’s Basketball Plays Two : With a student body of just under 600, St. Benedict’s has something that is rare among secondary schools: two varsity basketball teams that are among the nation’s elite.Art Buchwald, Whose Humor Poked the Powerful, Dies at 81 : Mr. Buchwald poked fun at the follies of the rich, the famous and the powerful for half a century.Theater Listings : THEATER.THE LISTINGS | JAN. 19 - JAN. 25 : Selective listings by critics of The New York Times of new and noteworthy cultural events in the New York metropolitan region this week. * denotes a highly recommended film, concert, show or exhibition.    Theater    Approximate running times are ..."
2007-01-22,12.734285,12.737143,12.235714,86.78999300000001,12.398571,363506500,"Prosecutor in Apple Case Joins Law Firm : Christopher J. Steskal, a lead prosecutor of a federal task force investigating the backdating of stock options at Apple and other companies, is leaving his San Francisco post to join a law firm, the United State Attorney's office in San Francisco...Figuring Out the P.E. Ratio of Steve Jobs : Apple's share price leaped to a record after the company unveiled its latest device to be hailed as the coolest thing ever, but investors are factoring more into their decision than a best guess on the number of iPhones Apple will sell. Ultimately...A Red Cat’s Journey, Enhanced by iTunes : Ry Cooder is most likely the first well-known musician to master his album using iTunes, but other producers have also noticed its effect.Big Labels Offer Free Music to College Students : Ruckus Network will offer free music downloads — with some substantial restrictions — to any college student.TODAY IN BUSINESS : DRUG ADS UNDER SCRUTINY -- Drug advertising aimed at consumers is likely to face hard scrutiny in the new Congress as it considers renewal of a law renewing the fees that manufacturers pay to speed reviews of new drugs. The pharmaceutical industry...Record Labels Contemplate Unrestricted Digital Music : Major record labels are moving closer to releasing music on the Internet with no copying restrictions.How Daisy Mae’s Charm Finds a Home at the Met : For better and sometimes for worse, Ms. Chenoweth embodied ultimate musical comedy stardom in 2007.Shares Fall on Downgrades of Tech Issues : Wall Street stumbled lower yesterday as growing concerns over technology companies led jittery investors to pull money out of the market ahead of earnings reports this week.CAMPAIGN SPOTLIGHT: Trying Not to Be Roadkill on the Schuylkill : Remember the jingle ""Baseball, hot dogs, apple pie and Chevrolet""? A musical campaign for a new Web site offers a version that could be called ""Phillies, cheese steaks, scrapple and all kinds of cars.""     The campaign is for Phillycars.com, a Web...Trying Not to Be Roadkill on the Schuylkill : The ad campaign for Phillycars.com attempts to play up the ability of online media to be targeted more narrowly than their mainstream, traditional counterparts."
2007-01-23,12.247143,12.501429,12.215714,85.699997,12.242857,301856100,"The iToaster, the iWatch and the iRon? : Designs for nonexistent Apple products.Attorney General Shake-Up May Delay Options Inquiries : The recent shake-up in the United States Attorney's office in San Francisco could lead to delays in the office's wide-ranging backdating investigation, according to The San Jose Mercury News. The turnover, which includes the departure of a United ...Strict Vegan Ethics, Frosted With Hedonism : “Punk taught me to question everything,” the vegan chef Isa Chandra Moskowitz told Julia Moskin in 2007. “Of course, in my case that means questioning how to make a Hostess cupcake without eggs, butter or cream.” Ms. Moskowitz's vegan cupcake call...Record Labels Contemplate Unrestricted Digital Music : Major record labels are moving closer to releasing music on the Internet with no copying restrictions.Dear Graydon ... : Frank Bruni visits the reopened Waverly Inn & Garden in Greenwich Village, where Graydon Carter, the editor of Vanity Fair magazine, is an owner. Shares Fall on Downgrades of Tech Issues : Wall Street stumbled lower yesterday as growing concerns over technology companies led jittery investors to pull money out of the market ahead of earnings reports this week.Recipe: Devil’s Food Cupcakes With Fluffy White Filling and Chocolate Icing : A recipe for devil’s food cupcakes with fluffy white filling and chocolate icing.Gimme an Oil Change and a Tankful of Ribs : Hard-core barbecue fans willing to make the trek to Hunts Point in the Bronx will find an expansive menu and tasty ribs at Mo Gridder’s. Blogging for Property Sales : Increasing numbers of potential buyers are joining online forums, downloading video and audio reports and reading blogs for property news and opinion.Move Over Silicon Valley, Here Come European Start-Ups : European entrepreneurs have taken the start-up culture pioneered in Silicon Valley as a template and are successfully transplanting it."
