Date,Open,High,Low,Close,Adj Close,Volume,News
2007-01-24,12.382857000000001,12.45,12.297143,86.700005,12.385715,231953400,"Valleywag: 'Steve Jobs Is in Jeopardy' : Steve Jobs may have briefly distracted everyone from the options-backdating scandal at Apple by waving the iPhone around at MacWorld, but Valleywag is offering what it calls a ""reality check,"" in which it lists five reasons it thinks that Mr. Jobs...Strict Vegan Ethics, Frosted With Hedonism : “Punk taught me to question everything,” the vegan chef Isa Chandra Moskowitz told Julia Moskin in 2007. “Of course, in my case that means questioning how to make a Hostess cupcake without eggs, butter or cream.” Ms. Moskowitz's vegan cupcake call...Most Horrible Sound in the World : British scientist concludes yearlong survey designed to uncover the most horrible sound in the world...Dear Graydon ... : Frank Bruni visits the reopened Waverly Inn & Garden in Greenwich Village, where Graydon Carter, the editor of Vanity Fair magazine, is an owner. McDonald’s Says Latest Results Are Strongest in 30 Years : McDonald’s has been on a tear that began in 2003 and has continued nearly unabated, aided by a Dollar Menu of favorites.Recipe: Devil’s Food Cupcakes With Fluffy White Filling and Chocolate Icing : A recipe for devil’s food cupcakes with fluffy white filling and chocolate icing.Gimme an Oil Change and a Tankful of Ribs : Hard-core barbecue fans willing to make the trek to Hunts Point in the Bronx will find an expansive menu and tasty ribs at Mo Gridder’s. Blogging for Property Sales : Increasing numbers of potential buyers are joining online forums, downloading video and audio reports and reading blogs for property news and opinion.Move Over Silicon Valley, Here Come European Start-Ups : European entrepreneurs have taken the start-up culture pioneered in Silicon Valley as a template and are successfully transplanting it.A Stream of Movies, Sort of Free : Netflix has rewritten the rules — this time, of the online movie-rental game. "
2007-01-25,12.444285,12.642858,12.29,86.25,12.321428,226493400,"McDonald’s Says Latest Results Are Strongest in 30 Years : McDonald’s has been on a tear that began in 2003 and has continued nearly unabated, aided by a Dollar Menu of favorites.Delays Limit Robust Sales at Microsoft : Microsoft reported strong sales but its financial results were muddled by the late arrival of important new products.A Stream of Movies, Sort of Free : Netflix has rewritten the rules — this time, of the online movie-rental game. Plain Cellphones Can Overachieve, With a Little Help : That humble cellphone in your pocket may let you do more than just make phone calls and take pictures.Theater Listings : THEATER.The Listings: Jan. 26-Feb. 1 : Theater    Approximate running times are in parentheses. Theaters are in Manhattan unless otherwise noted. Full reviews of current shows, additional listings, show times and tickets: nytimes.com/theater.         Previews and Openings    'ADRIFT IN..."
2007-01-26,12.444285,12.481428,12.141428999999999,85.379997,12.197142999999999,246718500,"Delays Limit Robust Sales at Microsoft : Microsoft reported strong sales but its financial results were muddled by the late arrival of important new products.‘Get Organized Now’ Month? Maybe in the Red States : You guessed it: liberals turn out to be messier than conservatives. More From Vanguard Chief John Brennan : Theater Listings : THEATER.The Listings: Jan. 26-Feb. 1 : Theater    Approximate running times are in parentheses. Theaters are in Manhattan unless otherwise noted. Full reviews of current shows, additional listings, show times and tickets: nytimes.com/theater.         Previews and Openings    'ADRIFT IN..."
2007-01-29,12.328571,12.378572,12.218572,85.939995,12.277142999999999,225416100,"TBWA Declines to Bid For Sprint Nextel Account : TBWA/Chiat/Day in New York has resigned its part of the Sprint Nextel creative account by declining an invitation to participate in a review that began Jan. 3.     TBWA/Chiat/Day, part of the TBWA Worldwide unit of the Omnicom Group, had created S...Hasbro Severs Relationship With Grey After 30 Years : Hasbro Severs Relationship.Barbaro Is Euthanized After Struggle With Injury : The Kentucky Derby winner was euthanized today after complications from his injury at the Preakness last May. "
2007-01-30,12.347142999999999,12.355714,12.178572,85.550003,12.221428999999999,144492600,"Verizon Profit Drops 38%, but Wireless Shows Growth : Verizon’s wireless businesses added 2.3 million new customers in the quarter, the bulk of them on long-term contracts. First the Wait for Microsoft Vista; Now the Marketing Barrage : Skeptics were drowned out by the marketing campaign for Microsoft’s operating system on the eve of its arrival.After Marketing Frenzy, a Tame Release for Vista : Microsoft introduced its new operating system at a time when its influence in the marketplace is waning.Big Plan for Small Courts: Seeking Money to Fix Them : New York State’s top court officials plan to ask the Legislature for at least $50 million over the next five years to revamp the state’s threadbare system of town and village courts.Non-Celebrities on the Web, Seeming to Make Non-Pitches : Marketers are turning to unusual personalities who offer the kind of novelty and freshness that young people might blog about, link to and comment on in chats.Gates, in London, Promotes Vista to Europeans : Bill Gates, co-founder and chairman of Microsoft, began a four-day European tour to promote the new operating system.Baquet Rejoins Times as Washington Bureau Chief : The former editor of The Los Angeles Times replaces Phil Taubman, who becomes associate editor of The Times.After 8 Months Filled by Hope, Setback Ends Barbaro’s Battle : The Kentucky Derby winner was euthanized, ending an extraordinary effort to save his life after a leg injury.A Lively Market, Legal and Not, for Software Bugs : Software vulnerabilities are bought and sold online, both by legitimate security companies and by thieves."
2007-01-31,12.122857000000002,12.285714,12.05,85.729996,12.247143,214017300,"Vista Arrives With Limited Fanfare : The quiet debut for Microsoft’s latest version of the Windows operating system reflects how the company’s influence has faded as the nature of computer software has changed.History Teacher Becomes Podcast Celebrity : In barely 18 months, the podcast ""12 Byzantine Rulers"" has become one of the phenomena of the podcasting world.Icahn Seeks Board Seat at Motorola : Carl C. Icahn, who has made a career of agitating for change at large companies, wants Motorola to use its $10.5 billion cash pile toward a huge buyback of shares.TODAY IN BUSINESS : INVESTING IN SMOKING -- The future of cigarettes appears to be brighter than ever. That is the message investors are sending as the Altria Group, the former Philip Morris, prepares to spin off its Kraft Foods division and become primarily a tobacc...A Top Editor Returns to Times to Lead Washington Bureau : Dean Baquet is returning to The New York Times as chief of its Washington bureau and an assistant managing editor."
2007-02-01,12.318571,12.324286,12.105714,84.739998,12.105714,166085500,"Al Gore, the Silicon Valley Guy : As pundits, voters and Washington insiders wonder whether former Vice President Al Gore will jump into the 2008 presidential race, The San Jose Mercury News discusses what it calls a ""political problem"" for Mr. Gore should he choose to run. The ne...Better Shoeboxes for Digital Photos : While digital photography has freed up closet space, sorting and retrieving pictures in the era of the 250-gigabyte hard drive has created a set of challenges of its own.Be the Next American Idol With Karaoke You Can Carry : The iKaraoke is a microphone that plugs into any iPod with a dock connector and processes any music that you own. Gordon Macklin, 78, Pioneer in Electronic Stock Trading, Dies : Gordon S. Macklin helped usher in the era of electronic trading of securities when he oversaw the development of the Nasdaq.The Weekends Just Get Longer and Longer : Jane Lockhart, who co-owns Sweet Lady Jane, the popular Los Angeles bakery, built a country retreat, with rosebushes, fruit trees and four ovens that are always on.Harry Potter’s Final Act Is Set for July 21 : Millions of fans around the world are fiercely anticipating  “Harry Potter and the Deathly Hallows.” Harry Potter’s Final Act Is Set for July 21 : Millions of fans around the world are fiercely anticipating  “Harry Potter and the Deathly Hallows.”Take It Away : Sometimes the only way to save a historic house is by making a radical move.Theater Listings : THEATER.The Listings: Feb. 2 - Feb. 8 : Selective listings by critics of The New York Times of new and noteworthy cultural events in the New York metropolitan region this week. * denotes a highly recommended film, concert, show or exhibition.    Theater    Approximate running times are ..."
2007-02-02,12.017142999999999,12.178572,11.957142999999999,84.75,12.107142,155382500,"2nd Acts in the Executive Suite : Second-act chief executives bring deep knowledge of their industries and their companies, but may be reluctant to make radical changes.Another Prosecutor Moves to the Greener Pastures of Private Law : Former Enron prosecutor Kathy Ruemmler has joined the law firm of Latham & Watkins in Washington, D.C., confirming speculation that she would follow some of her former colleagues into private practice - and a higher income bracket. Ms. Ruemmler wa...The Weekends Just Get Longer and Longer : Jane Lockhart, who co-owns Sweet Lady Jane, the popular Los Angeles bakery, built a country retreat, with rosebushes, fruit trees and four ovens that are always on.Cellphone Envy Lays Motorola Low : Motorola is learning a cruel new lesson that a phone’s value reflects not so much what it can do, but whether it is the envy of friends.Harry Potter’s Final Act Is Set for July 21 : Millions of fans around the world are fiercely anticipating  “Harry Potter and the Deathly Hallows.”Theater Listings : THEATER.The Listings: Feb. 2 - Feb. 8 : Selective listings by critics of The New York Times of new and noteworthy cultural events in the New York metropolitan region this week. * denotes a highly recommended film, concert, show or exhibition.    Theater    Approximate running times are ..."
2007-02-05,12.042857000000001,12.175714,11.991427999999999,83.940002,11.991427999999999,144713100,"After Long Dispute, Two Apples Work It Out : Apple Inc., the maker of the iPod, and Apple Corps, the guardian of the Beatles’ music interests, have settled their trademark fight over their shared name.INSIDE : Iranian Abducted in Iraq By Men With Official ID  An Iranian diplomat was abducted when his convoy was stopped in Baghdad by men with official Defense Ministry identification, senior Iraqi and American officials said, raising questions about wheth...2nd Acts in the Executive Suite : When James R. Houghton began a second stint as chief executive at Corning in 2002, the company was reeling. The first thing he did, Mr. Houghton told The New York Times, was ""to see if there was somebody I should shoot."" Now Michael S. Dell will b...Deals Galore, but Caution Rules Investors : Wall Street closed mixed yesterday as lingering concerns about the economy offset better-than-expected sales from Wal-Mart Stores and a flurry of acquisition activity.TODAY IN BUSINESS : AN INQUIRY ON WALL STREET -- The Securities and Exchange Commission is examining whether Wall Street bank employees have been leaking information about big trades to their favored clients like hedge funds as a way to curry favor with those clients...News Summary : INTERNATIONAL A3-11    In Shift, Saudis Push To Counter Iran in Region  With the prospect of three civil wars looming over the Middle East, Saudi Arabia has taken on a central, aggressive role in reshaping the region's conflicts. The kingdom is pl...Wal-Mart and Studios in Film Deal : Wal-Mart will introduce a partnership with all of the six major Hollywood studios  to sell digital movies and television shows on its Web site.How Do We See Red? Count the Ways : Red the color is a fine metaphoric mate for the complexity and contrariness of love. "