Date,Open,High,Low,Close,Adj Close,Volume,News
2006-12-01,13.114285,13.19,12.871428,91.32,13.045714,198769900,"WHAT'S ON TONIGHT : 8 P.M. (TLC) ASHLEY JUDD AND YOUTHAIDS: CONFRONTING THE PANDEMIC -- In 2002 Ms. Judd (above right) became the goodwill ambassador for YouthAIDS, an organization that promotes AIDS prevention and treatment. In this special she travels through Centr...A Bubble Watcher Watches Google : Compared with the late-’90s technology boom, there are few initial public offerings, making it harder to determine when an Internet downturn has begun.For Residents in the West Bronx, an Online Newspaper : Community journalism has finally come to Mount Hope in the form of The Mount Hope Monitor, an online newspaper.Sony Shifts Duties of the Leader of the PlayStation Unit : Ken Kutaragi, the father of the PlayStation game console, will no longer run the day-to-day affairs of Sony’s video game unit.The World, and the City, According to Steinberg : The shows at both the Morgan Library and the Museum of the City of New York confirm Saul Steinberg’s status as the veritable Leonardo of graphic drollery.Theater Listings : THEATER.The Listings: Dec. 1 - Dec. 7 : Selective listings by critics of The New York Times of new and noteworthy cultural events in the New York metropolitan region this week. * denotes a highly recommended film, concert, show or exhibition.    Theater    Approximate running times are ..."
2006-12-04,13.125714000000002,13.15,12.928572,91.120003,13.017142999999999,177384200,"More on Housing Prices : The broadest government measure of house prices is calculated by the Office of Federal Housing Enterprise Oversight, the agency that oversees Fannie Mae and Freddie Mac. The idea at the heart of the index is a good one. It tries to do the same sor...Bucking McCain the Maverick : McCain goes maverick on Iraq; Borat as cultural ambassador; Iceland as eco-villain.Foolishly, an Angel Falls in Love and Rushes In ... and Up : This new stage adaptation of the Wim Wenders movie, in a production at the American Repertory Theater in Cambridge, Mass., is alternately stimulating and unsatisfying.As Ad Costs Rise, a Move to Challenge Pay-Per-Click : On some new shopping search sites, advertisers pay only when someone actually buys something, or when users view an ad."
2006-12-05,13.092857,13.19,12.981428,91.269997,13.038571000000001,165709600,
2006-12-06,12.948571000000001,13.055715,12.81,89.83000200000001,12.832857,159546100,"Honoring R.W. Apple in Words and Food : About 1,000 of R.W. Apple’s admirers turned out for a funny, sad and immensely caloric tribute to The New York Times writer at the Kennedy Center memorial on Tuesday.Bono's Elevation Seeks Time's Parenting Titles, Report Says : On the heels of news that the auction for Time Inc.'s Time4Media publications had stalled, the New York Post reported that Elevation Partners, the private equity group founded by philanthropist and sometime rocker Bono, has entered the fray. The b...Defense Nominee Gains Approval of Senate Panel : Robert M. Gates said the recommendations to be made public this morning by the Iraq Study Group would be important but not “the last word.”"
2006-12-07,12.861428,12.928572,12.414286,87.040001,12.434286,251206900,"Homebuilders, and Worries Over Jobs, Lead a Decline : Stocks fell for a second day on anticipation that this week’s jobs report would show worsening unemployment.An Urban Alternative to a Rural Menagerie : Finding an anonymous nonjudgmental haven away from the small-town microscope.Theater Listings : THEATER.The Listings: Dec. 8 - Dec. 14 : Selective listings by critics of The New York Times of new and noteworthy cultural events in the New York metropolitan region this week. * denotes a highly recommended film, concert, show or exhibition.    Theater    Approximate running times are ..."
2006-12-08,12.461428999999999,12.77,12.428572,88.25999499999999,12.608571000000001,196069300,"Homebuilders, and Worries Over Jobs, Lead a Decline : Stocks fell for a second day on anticipation that this week’s jobs report would show worsening unemployment.Complaining Correctly Can Pay Off : Some advice from call center managers and supervisors on the best methods for getting what you want.An Urban Alternative to a Rural Menagerie : Finding an anonymous nonjudgmental haven away from the small-town microscope.Theater Listings : THEATER.The Listings: Dec. 8 - Dec. 14 : Selective listings by critics of The New York Times of new and noteworthy cultural events in the New York metropolitan region this week. * denotes a highly recommended film, concert, show or exhibition.    Theater    Approximate running times are ..."
2006-12-11,12.7,12.757143,12.578571,88.75,12.678572,124945100,"Sales of iPods and iTunes Not Much in Sync : The numbers suggest that iPods are not driving iTunes sales as much as early supporters may have expected.Name That Source : Decades on, a Vietnam War-era mystery has been revealed.In City’s Trans Fat Ban, a Challenge Fit for a Chef : Many in the restaurant industry say they fear that they will not be able to replicate dishes that now exceed the limit on trans fats.After Nasdaq Chief's Irish Bash, a Long Hangover : Even as the Nasdaq Stock Market battles to acquire a recalcitrant London Stock Exchange, Nasdaq's chief executive is in a trans-Atlantic feud of his own over a week of medieval revelry in Ireland. According to the New York Daily News, Robert Greif...Lights! Camera! Advertising! : Squeezing Money From the Music : Major labels have begun demanding a cut of concert earnings or T-shirt, ring tone and merchandise revenue from new artists seeking record contracts. "
2006-12-12,12.658571,12.691428,12.218572,86.139999,12.305715,256655000,
2006-12-13,12.564285,12.724286,12.45,89.050003,12.721428999999999,214263000,"Op-Art; iDentities : Op-Art by Seymour Chwast portrays imaginative, customized iPod earbudsVista Wins on Looks. As for Lacks ... : Microsoft’s new operating system, Vista, will soon be on sale to the public. But you may need a new computer to run it properly.H.P. Board Cuts Its Ties With Lawyer : Hewlett-Packard’s board is said to have ended a crucial advisory relationship with Larry W. Sonsini, the powerful Silicon Valley lawyer.Helping a Balky Laptop : I get an occasional “insufficient system resources exist to complete the API” message when I try to put my laptop in hibernation. What can I do?Democrats to Decide Soon on New York Bid for ’08 : New York officials were increasingly confident that the party would turn to their city for its convention for the first time in 16 years.Democrats to Decide Soon On New York Bid for '08 : Democratic officials moved into the final stage of deliberations yesterday about where to place their party's 2008 nominating convention, with New York officials saying they were increasingly confident that the party would turn to their city for i...In College, You Can Go Home Again and Again : The empty nest isn’t what many parents expected it would be when their children left for college. Many  students seem to be home almost as much as they’re away."
2006-12-14,12.721428999999999,12.857142,12.608571000000001,88.549995,12.65,208082700,"Adam, She’s Ms. Madam : Kristin Chenoweth uses every theatrical weapon in her lavishly stocked arsenal to make this revival of ""The Apple Tree"" her own.Op-Art; iDentities : Op-Art by Seymour Chwast portrays imaginative, customized iPod earbudsINSIDE : Last-Minute Health Benefits Slipped Into Bill  Lawmakers managed to quietly add provisions resulting in a change in Medicare policy, securing special treatment for a hospice and financing a vaccine to a grab bag of legislation, illustrating how po...Vista Wins on Looks. As for Lacks ... : Microsoft’s new operating system, Vista, will soon be on sale to the public. But you may need a new computer to run it properly.Alan F. Shugart, 76, a Developer of Disk Drive Industry, Dies : Alan F. Shugart was an engineer and entrepreneur whose career defined the modern computer disk drive industry.Helping a Balky Laptop : I get an occasional “insufficient system resources exist to complete the API” message when I try to put my laptop in hibernation. What can I do?H.P. Board Cuts Its Ties With Lawyer : Hewlett-Packard’s board is said to have ended a crucial advisory relationship with Larry W. Sonsini, the powerful Silicon Valley lawyer.Democrats to Decide Soon On New York Bid for '08 : Democratic officials moved into the final stage of deliberations yesterday about where to place their party's 2008 nominating convention, with New York officials saying they were increasingly confident that the party would turn to their city for i...Democrats to Decide Soon on New York Bid for ’08 : New York officials were increasingly confident that the party would turn to their city for its convention for the first time in 16 years.She Will Not Speak. Words Fail Her. : As its title suggests, this eccentric film written and directed by Isabel Coixet contemplates the insufficiency of language to encapsulate traumatic experience."
2006-12-15,12.717143,12.745714,12.475715,87.720001,12.531428,184984800,"Adam, She’s Ms. Madam : Kristin Chenoweth uses every theatrical weapon in her lavishly stocked arsenal to make this revival of ""The Apple Tree"" her own.Blog That Answer : You can have your Answers.com, your Google Answers, your Wikipedia. Me, I've got a source of answers that blows them off the map: this blog.INSIDE : Last-Minute Health Benefits Slipped Into Bill  Lawmakers managed to quietly add provisions resulting in a change in Medicare policy, securing special treatment for a hospice and financing a vaccine to a grab bag of legislation, illustrating how po...Dow Ends Week With Record Close : Wall Street extended its advance after reports showed inflation remained tame in November and industrial production rose for the first time in two months.Alan F. Shugart, 76, a Developer of Disk Drive Industry, Dies : Alan F. Shugart was an engineer and entrepreneur whose career defined the modern computer disk drive industry.She Will Not Speak. Words Fail Her. : As its title suggests, this eccentric film written and directed by Isabel Coixet contemplates the insufficiency of language to encapsulate traumatic experience.LIVING HERE | Converted Barns; Livestock to Living Room : WHO -- George Romano, 62, retired supermarket manager, from Patchogue, N.Y.  WHERE -- Lexington, N.Y.  WHAT -- 5-bedroom converted barn       In 1997, my wife, Anne, and I were shopping for land, and this property had 75 acres. We saw the barn as ...Fruits of Design, Certified Organic : Like its predecessors, the Cooper-Hewitt National Design Museum’s third National Design Triennial is a crazed affair that illuminates a volatile, contradictory, ever-expanding field but fails to call it to order.Arts, Briefly : CBS to start a record label, Harry Potter wins a round, the French actor Samy Naceri faces jail for racial abuse and more culture news.A Rare South Florida Community With Room to Grow : This city at the center of South Florida’s retiree and second-home-owner social scene is developing a cachet it has long lacked."
2006-12-18,12.518572,12.571428,12.084286,85.470001,12.21,180394200,"Apple Delays Earnings Statement Due to Options Grants : Apple Computer, the maker of iPod music players, delayed filing its financial statements on Friday for the second time, and said it would restate earnings to account for backdated stock-option grants. The size of any charge related to the options ...The Redmond Copying Machine? : Just how formalized is Microsoft's copying department?Miss USA Agrees to Rehab to Preserve Reign : Donald J. Trump announced today that Tara Conner would go into a rehabilitation program and be given a second chance to retain her tiara.Old Model Versus a Speedster : As they ponder how to outdo YouTube, media giants like NBC Universal and Viacom are discussing partnering to build a competing distributor of Internet video.Study Finds Outside Directors Also Got Backdated Options : A new study suggests that some 1,400 outside directors may have received manipulated stock option grants over the past decade."
2006-12-19,12.104285,12.382857000000001,11.945714,86.309998,12.33,227851400,"Maple’s Got Some New Tricks : Maple has new dimensions.Only the Jailers Are Safe : Except for the few low-ranking soldiers periodically punished for abusing prisoners, the system of American military prisons in Iraq is without any accountability.Miss USA Agrees to Rehab to Preserve Reign : Donald J. Trump announced today that Tara Conner would go into a rehabilitation program and be given a second chance to retain her tiara.The Corporate Housing Solution : Corporate housing can be a boon for developers during a building’s transition from rental to condominium or for condominium investors facing a sluggish market."
2006-12-20,12.352858,12.381428999999999,12.105714,84.75999499999999,12.108571000000001,141922900,"Recent Openings  : New shows in New York include revivals of ""The Apple Tree"" and ""Meet Me in St. Louis.""Subscriptions for a Browser : How do I use R.S.S. feeds with Internet Explorer 7?Paid Notice: Deaths   BERNSTEIN, SHIRLEY, (NEE SMITHLINE) : BERNSTEIN--Shirley, (nee Smithline), 80, of Manhattan, died at home on December 20, 2006 after a long struggle with cancer. Revered wife of the late Col. Emanuel Bernstein. Beloved mother of Donald and mother-in-law of Jo Ellen Finkel, adored sist...Maple’s Got Some New Tricks : Maple has new dimensions.With Warmer Weather, Different Decisions to Make : Climate changes are rewriting the books on planting patterns.Only the Jailers Are Safe : Except for the few low-ranking soldiers periodically punished for abusing prisoners, the system of American military prisons in Iraq is without any accountability.A Gucci Loafer, Filled With Feathers : Leave it to Europeans to make a down ski jacket look dashing.The Corporate Housing Solution : Corporate housing can be a boon for developers during a building’s transition from rental to condominium or for condominium investors facing a sluggish market."
2006-12-21,12.1,12.211428999999999,11.742857,82.900002,11.842857,225899800,
2006-12-22,11.922857,12.005714,11.657143,82.199997,11.742857,153325900,"&#039;Right on the Money&#039;  : Kristin Chenoweth talks about her roles in ""The Apple Tree"" and ""The West Wing.""Deal Chatter 2006: What Got You Talking : A would-be banker who does ballroom dancing. The life of a first-year lawyer. Steve Jobs. These were a few of the topics that got DealBook readers talking - a lot. As a year-end experiment, we went through the DealBook posts of 2006 and found the ...Music Labels’ Lawsuit Seeks Shutdown of Russian Online Service : The recording companies sued the operator of a Russian online music service in the U.S., hoping that American courts can accomplish what international efforts have not.With Owners in the Dark, Stocks Go Up : Companies can now keep trading on major markets while giving out only the numbers they choose, and investors don’t seem to mind.Theater Listings : THEATER.The Listings: Dec. 22 - Dec. 28 : Theater    Approximate running times are in parentheses. Theaters are in Manhattan unless otherwise noted. Full reviews of current shows, additional listings, show times and tickets: nytimes.com/theater.    Previews and Openings    'THE SCENE' In ..."
2006-12-26,11.735714,11.795714,11.555715,81.510002,11.644286,122672200,"Waiting to Take You Away on a Fact-Filled Tour : These are the Beatle books and authors mentioned in this article:.Event Planning, Doing-the-Impossible Division : If you think planning a business trip is stressful, try organizing one for thousands of people. At once.Electronics Help Amazon Post Record-Setting Holiday Orders : Web retailer Amazon.com set a single-day sales record on Dec. 11 with more than four million orders placed.A Book Publisher, Beatlemaniacs? Why Don't You Do It on Your Own? : Maybe you thought the publishing world had exploited every bit of information about the Beatles, useful and trivial, in the Himalayan stack of books published since the group's heyday in the 1960s: biographies both straight and gossipy, musical an...A Book Publisher, Beatlemaniacs? Why Don’t You Do It on Your Own? : If mainstream publishers reject their work as too specialized, even the most Beatles-obsessed authors are finding audiences for their books by publishing them themselves.Avoidance vs. Choices in Iraq : To the Editor:     Frank Rich's Dec. 24 column, ''Yes, You Are the Person of the Year!,'' cites several methods Americans use to avoid thinking about the Iraq quagmire. Yet he doesn't address a major reason for the avoidance: What else can they do...Avoidance vs. Choices in Iraq (6 Letters) : To the Editor:.As Minds Age, What’s Next? Brain Calisthenics : Brain health programs are offering the possibility of a cognitive fountain of youth.Iran Is Seeking More Influence in Afghanistan : Iran is investing in Afghanistan as part of a bigger drive to spread its influence and ideas farther across the Middle East. "
2006-12-27,11.164286,11.714286,10.967143,81.520004,11.645715,483938700,"Apple Shares Buffeted by Report on Options Inquiry : Investors discounted the possibility that Apple chief Steven P. Jobs might be implicated in an investigation of the company’s stock option grants.The iPhone Really Exists but Apple Doesn’t Make It : Cisco Systems, not Apple, owns the iPhone trademark, and several new iPhone products have been announced recently, including a handset that lets you make calls over Wi-Fi networks using Skype.It's a Wireless Media Center, But Where's the Hard Drive? : The Mvix MX-760HD media server has a lot of features, but out of the box it's missing one important thing: a hard drive. Mvix can supply a hard drive when you place an order through its store, but you'll have to install it yourself, a simple proce...It’s a Wireless Media Center, but Where’s the Hard Drive? : Once you’ve installed a hard drive, the Mvix MX-760HD acts as both a storage server and as a media player.Electronics Help Amazon Post Record-Setting Holiday Orders : Web retailer Amazon.com set a single-day sales record on Dec. 11 with more than four million orders placed.Portfolio Polishing Helps Dow Set Record : The Dow surged past 12,500 for the first time as year-end bargain hunters picked up stocks across a variety of sectors.Considering a Media Center PC : I see lots of machines with ""Windows XP Media Center Edition 2005."" What is the difference between this and good old XP?Avoidance vs. Choices in Iraq : To the Editor:     Frank Rich's Dec. 24 column, ''Yes, You Are the Person of the Year!,'' cites several methods Americans use to avoid thinking about the Iraq quagmire. Yet he doesn't address a major reason for the avoidance: What else can they do...Avoidance vs. Choices in Iraq (6 Letters) : To the Editor:.Cellphones for the Music Fan : A few mobile phones nearly equal the iPod in sound and simplicity."
2006-12-28,11.46,11.607142,11.378572,80.870003,11.552857000000001,279969200,"Apple Shares Buffeted by Report on Options Inquiry : Investors discounted the possibility that Apple chief Steven P. Jobs might be implicated in an investigation of the company’s stock option grants.The iPhone Really Exists but Apple Doesn’t Make It : Cisco Systems, not Apple, owns the iPhone trademark, and several new iPhone products have been announced recently, including a handset that lets you make calls over Wi-Fi networks using Skype.It's a Wireless Media Center, But Where's the Hard Drive? : The Mvix MX-760HD media server has a lot of features, but out of the box it's missing one important thing: a hard drive. Mvix can supply a hard drive when you place an order through its store, but you'll have to install it yourself, a simple proce...It’s a Wireless Media Center, but Where’s the Hard Drive? : Once you’ve installed a hard drive, the Mvix MX-760HD acts as both a storage server and as a media player.Portfolio Polishing Helps Dow Set Record : The Dow surged past 12,500 for the first time as year-end bargain hunters picked up stocks across a variety of sectors.Considering a Media Center PC : I see lots of machines with ""Windows XP Media Center Edition 2005."" What is the difference between this and good old XP?Cellphones for the Music Fan : A few mobile phones nearly equal the iPod in sound and simplicity.Brilliant Ideas That Found a Welcome : A top 10 list — not of the greatest tech products, but of the greatest individual features that surfaced in 2006."
2006-12-29,11.992857,12.2,11.908571,84.839996,12.12,269107300,"Apple Filing to Tell All on Options : Apple is likely to answer questions about backdated options granted to chief executive Steven P. Jobs and others in a delayed annual report.Apple Says Options Probe Exonerates Executives : Apple said that its chief executive, Steven P. Jobs, did not benefit financially from any questionable stock awards.TODAY IN BUSINESS : F.D.A. APPROVES CLONES -- After years of delay, the Food and Drug Administration has tentatively concluded that milk and meat from some cloned farm animals are safe to eat. That finding could make the United States the first country to allow produ...Shares Fall on Release of Economic Data : Reports about a stronger economy raised concerns that the Fed might be more aggressive about interest rates next year.Theater Listings : THEATER.The Listings: Dec. 29 - Jan. 4 : Selective listings by critics of The New York Times of new and noteworthy cultural events in the New York metropolitan region this week. * denotes a highly recommended film, concert, show or exhibition.    Theater    Approximate running times are ..."
2007-01-03,12.327143,12.368571000000001,11.7,83.800003,11.971428999999999,309579900,"Apple, Google and Napster Named in Patent Lawsuit : Intertainer, a video-on-demand company, last week filed a broad lawsuit asserting that Apple, Google and Napster are infringing on a 2005 patent that covers the commercial distribution of audio and video over the Internet. Founded by Jonathan T. T...Corrections : A headline in Business Day yesterday about a lawsuit brought by Intertainer, a digital media company, against Apple Computer, Google and Napster misstated the nature of the litigation. It involves a patent, not a copyright.  Patent Lawsuit Names Leading Technology Firms : The latest patent dispute pits Apple, Google and Napster against a company that closed five years ago.Correction: For the Record : A headline in Business Day yesterday about a lawsuit brought by Intertainer, a digital media company, against Apple Computer, Google and Napster misstated the nature of the litigation. It involves a patent, not a copyright.Fewer Excuses For Not Doing A PC Backup : If there's one New Year's resolution even more likely to fail than ''I vow to lose weight,'' it's ''I vow to start backing up my computer.''     After all, setting up and remembering to use a backup system is a huge hassle. The odds are good that ...Corrections : CorrectionsTODAY IN BUSINESS : HELP WANTED AT GOOGLE -- Desperate to hire more engineers and sales people, Google is looking for applicants with interesting backgrounds, not just high grades. [Page C1.]    ROMANIAN FARMER VS. MINING GIANT -- A small-time Romanian farmer is batt...Fewer Excuses for Not Doing a PC Backup : Online backups, where files are shuttled off to the Internet for safekeeping, are suddenly becoming effortless, capacious and even free.Sensing Opportunity in Dormitory Air : Younger customers are at the forefront of a boom in air fresheners as companies pour money into advertisements making the products seem cool. "
2007-01-04,12.007143,12.278571000000001,11.974286,85.65999599999999,12.237143,211815100,"Corrections : A headline in Business Day yesterday about a lawsuit brought by Intertainer, a digital media company, against Apple Computer, Google and Napster misstated the nature of the litigation. It involves a patent, not a copyright.  Macworld Rumors : The hottest rumors revolving around the upcoming Macworld convention are about the new products that could be introduced: an Apple cellphone/iPod, a touchscreen iPod and a Macintosh tablet.Correction: For the Record : A headline in Business Day yesterday about a lawsuit brought by Intertainer, a digital media company, against Apple Computer, Google and Napster misstated the nature of the litigation. It involves a patent, not a copyright.Fewer Excuses For Not Doing A PC Backup : If there's one New Year's resolution even more likely to fail than ''I vow to lose weight,'' it's ''I vow to start backing up my computer.''     After all, setting up and remembering to use a backup system is a huge hassle. The odds are good that ...No Place for a Zamboni: A Hockey Rink Where Players Sink : Underwater hockey — a sport incorporating lead pucks, stout wooden sticks, rubberized gloves, snorkels, face masks and bulbous ear guards — is in a realm of its own.Corrections : CorrectionsConrad Black: a Media King Dethroned : New York, according to Vanity Fair's Maureen Orth, was Conrad Black's downfall. It was in New York, Ms. Orth writes in a long examination of the indicted former chairman of the Hollinger Group, that ""the jury-rigged empire he had constructed to sa...Fewer Excuses for Not Doing a PC Backup : Online backups, where files are shuttled off to the Internet for safekeeping, are suddenly becoming effortless, capacious and even free.Theater Listings : THEATER.Strange Love : Cold war relics in Arizona, New Mexico and Nevada teach visitors how to love the bomb without worrying.  "
